{"format":1,"packs":[{"id":"16x","resolution":16,"sha1":"3b1e5c0d9a8f7e6d5c4b3a291807f6e5d4c3b2a1","size":123456,"url":"https://cdn.onelitefeather.net/packs/cygnus/3b1e5c0d9a8f7e6d5c4b3a291807f6e5d4c3b2a1.zip"},{"id":"32x","resolution":32,"sha1":"a07d1e2f3a4b5c6d7e8f90a1b2c3d4e5f6a7b8c9","size":234567,"url":"https://cdn.onelitefeather.net/packs/cygnus/a07d1e2f3a4b5c6d7e8f90a1b2c3d4e5f6a7b8c9.zip"}],"project":"cygnus","projectId":"5b0c7a52-3c1e-4d7a-9f2e-0a1b2c3d4e5f","provenance":{"createdAt":"2026-10-29T10:00:00Z","createdBy":"stelaris","generator":"2.0.0"},"revision":"sha256:a79f668ed6c27316205f5638b5bfcfc887ec0c28a6fbaac50908771fa5518a51","version":"1.4.0"}
